{
  "$schema": "https://aktreader.org/schema/reader-label-1.0.0-v1.4.json",
  "schema_version": "1.0.0",
  "label_id": "serock-1877-b-001.readera-w006",
  "record_id": "serock-1877-b-001",
  "created_at": "2026-08-04T00:00:00Z",
  "reader": {
    "reader_id": "readerA-w006-20260804",
    "reader_family": "claude",
    "reader_version": "claude-fable-5",
    "mode": "subscription_session",
    "blind_group_id": "serock-1877-births-01-10-wave-006",
    "other_reader_output_seen": false
  },
  "prompt": {
    "version": "1.4.0",
    "sha256": "5d14dcb892bd1ca2f236e472adf04656a98cdad51acb40fea8797265b09fca7a",
    "path": "prompts/reader_prompt.md"
  },
  "clerk_year": {"id": "serock-1877", "basis": "REGISTER_YEAR_PROXY", "clerk_id": null},
  "artifact": {
    "path": "D:/E-Drive-Preserve/DNA/BulkData/Serock_0826d/1877/births/Serock_1877_births_01-02.jpg",
    "sha256": "7b279f1f117edbd52657ddf71a4abb0c50562e0bca677a31567581a1aac9e454",
    "width_px": 3044,
    "height_px": 2412,
    "page_index": 0,
    "act_region": {"x": 1430, "y": 200, "width": 1614, "height": 1200, "coordinate_space": "source_pixels"}
  },
  "target": {"town": "Serock", "fond": "73/826/0", "year": 1877, "act_type": "birth", "act_no": 1, "language": "ru"},
  "source_spans": {
    "act-region": {"bbox": {"x": 1430, "y": 200, "width": 1614, "height": 1200, "coordinate_space": "source_pixels"}, "description": "full act 1 region, right page top, margin No 1 Popowo"},
    "opening-lines": {"bbox": {"x": 1440, "y": 230, "width": 1600, "height": 180, "coordinate_space": "source_pixels"}, "description": "venue and registration date/hour lines"},
    "declarant-lines": {"bbox": {"x": 1440, "y": 370, "width": 1600, "height": 170, "coordinate_space": "source_pixels"}, "description": "declarant name, occupation, age, residence"},
    "witness-lines": {"bbox": {"x": 1440, "y": 490, "width": 1600, "height": 180, "coordinate_space": "source_pixels"}, "description": "witnesses with occupations and ages"},
    "birth-lines": {"bbox": {"x": 1440, "y": 640, "width": 1600, "height": 220, "coordinate_space": "source_pixels"}, "description": "presentation of child, sex, birth place, dual birth date, hour"},
    "mother-line": {"bbox": {"x": 1440, "y": 800, "width": 1600, "height": 90, "coordinate_space": "source_pixels"}, "description": "mother, maiden name, age"},
    "naming-line": {"bbox": {"x": 1440, "y": 870, "width": 1600, "height": 80, "coordinate_space": "source_pixels"}, "description": "naming at circumcision"},
    "signatures": {"bbox": {"x": 1440, "y": 1000, "width": 1600, "height": 220, "coordinate_space": "source_pixels"}, "description": "signatures of declarant, witnesses, registrar line with flourish"}
  },
  "mentions": [
    {"mention_id": "serock-1877-b-001#principal", "role": "principal"},
    {"mention_id": "serock-1877-b-001#father", "role": "father"},
    {"mention_id": "serock-1877-b-001#mother", "role": "mother"},
    {"mention_id": "serock-1877-b-001#witness1", "role": "witness"},
    {"mention_id": "serock-1877-b-001#witness2", "role": "witness"},
    {"mention_id": "serock-1877-b-001#officiant", "role": "officiant"}
  ],
  "transcription": {
    "original_script": "№ 1. Попово. Состоялось въ Посадѣ Сероцкѣ третьяго / пятнадцатаго Января, тысяча восемьсотъ семьдесятъ седьмаго года, въ десять часовъ утра. — Явился лично Мойсеева Закона Довидъ Соляржъ, пахцяржъ, шестидесяти четырехъ лѣтъ отъ роду, въ деревнѣ Поповѣ жительствующій, въ присутствіи свидѣтелей Мойсеева Закона Файвеля Розенберга, лавочника, [unclear: тридцати одного/пятидесяти одного] лѣтъ отъ роду, и [unclear: Мошка/Мортки] [unclear: Фишбина/Фридмана], мясника, сорока четырехъ лѣтъ отъ роду, здѣсь въ Сероцкѣ жительствующихъ, и предъявилъ намъ младенца мужескаго пола, объявляя, что онъ родился въ деревнѣ Поповѣ двадцать седьмаго Декабря / восьмаго Января, тысяча восемьсотъ семьдесятъ шестаго / седьмаго года, въ четыре часа утра, отъ законной его жены Хавы, урожденной Бурштынъ, сорока двухъ лѣтъ отъ роду. Младенцу этому при обрѣзаніи дано имя [unclear: Янкель/Ханкель]. Актъ сей объявляющему и свидѣтелямъ прочитанъ, а затѣмъ объявляющимися, свидѣтелями, а также нами подписанъ. dawid soliarz. [unclear: Мордка Фришбинъ/Мортка Фишбинъ]. [unclear: Файвель Розенбергъ?]. Содержащій Акты Гражданскаго Состоянія.",
    "translation": "No. 1. Popowo. It took place in the posad of Serock on the third / fifteenth of January, one thousand eight hundred seventy-seven, at ten o'clock in the morning. Appeared in person Dowid Solarz of the Mosaic faith, leaseholder (pachciarz), sixty-four years old, residing in the village of Popowo, in the presence of witnesses of the Mosaic faith Fajwel Rozenberg, shopkeeper, [unclear: thirty-one/fifty-one] years old, and [unclear: Moszek/Mortka] [unclear: Fiszbin/Frydman], butcher, forty-four years old, both residing here in Serock, and presented to us an infant of male sex, declaring that he was born in the village of Popowo on the twenty-seventh of December / eighth of January of the year one thousand eight hundred seventy-six / seven, at four o'clock in the morning, of his lawful wife Chawa nee Bursztyn, forty-two years old. To this infant at circumcision was given the name [unclear: Jankiel/Chankiel]. This act was read to the declarant and the witnesses and then signed by the declarant, the witnesses and by us. [signatures] dawid soliarz; [unclear: Mordka Friszbin/Mortka Fiszbin]; [unclear: Fajwel Rozenberg?]. Keeper of Civil Status Acts [flourish signature]."
  },
  "observations": {
    "registration_place": {"value": "Serock (posad)", "original_script": "Состоялось въ Посадѣ Сероцкѣ", "confidence": "PROBABLE", "observation_state": "PRESENT", "alternatives": [], "source_span_ids": ["opening-lines"], "notes": []},
    "registration_date": {"value": "1877-01-15", "original_script": "третьяго / пятнадцатаго Января, тысяча восемьсотъ семьдесятъ седьмаго года", "confidence": "PROBABLE", "observation_state": "PRESENT", "alternatives": [{"value": "1877-01-03 (Julian)", "original_script": "третьяго"}], "source_span_ids": ["opening-lines"], "notes": ["dual date physically present; 12-day gap checks out"]},
    "registration_hour": {"value": "10:00 morning", "original_script": "въ десять часовъ утра", "confidence": "PROBABLE", "observation_state": "PRESENT", "alternatives": [], "source_span_ids": ["opening-lines"], "notes": []},
    "father.name": {"value": "Dowid Solarz", "original_script": "Довидъ Соляржъ", "confidence": "PROBABLE", "observation_state": "PRESENT", "alternatives": [], "source_span_ids": ["declarant-lines", "signatures"], "notes": ["Latin-script signature 'dawid soliarz' supports the surname reading"]},
    "father.occupation": {"value": "pachciarz (leaseholder)", "original_script": "пахцяржъ", "confidence": "PROBABLE", "observation_state": "PRESENT", "alternatives": [], "source_span_ids": ["declarant-lines"], "notes": ["Polish occupation term rendered in Cyrillic"]},
    "father.age": {"value": 64, "original_script": "шестидесяти четырехъ лѣтъ отъ роду", "confidence": "PROBABLE", "observation_state": "PRESENT", "alternatives": [], "source_span_ids": ["declarant-lines"], "notes": []},
    "father.residence": {"value": "village Popowo", "original_script": "въ деревнѣ Поповѣ жительствующій", "confidence": "PROBABLE", "observation_state": "PRESENT", "alternatives": [], "source_span_ids": ["declarant-lines"], "notes": ["margin annotation also reads Попово"]},
    "witness1.name": {"value": "Fajwel Rozenberg", "original_script": "Файвеля Розенберга", "confidence": "PROBABLE", "observation_state": "PRESENT", "alternatives": [], "source_span_ids": ["witness-lines"], "notes": []},
    "witness1.occupation": {"value": "shopkeeper", "original_script": "лавочника", "confidence": "PROBABLE", "observation_state": "PRESENT", "alternatives": [], "source_span_ids": ["witness-lines"], "notes": []},
    "witness1.age": {"value": "[unclear: 31/51]", "original_script": "[unclear: тридцати одного/пятидесяти одного] лѣтъ отъ роду", "confidence": "UNCLEAR", "observation_state": "PRESENT", "alternatives": [{"value": 31, "original_script": "тридцати одного"}, {"value": 51, "original_script": "пятидесяти одного"}], "source_span_ids": ["witness-lines"], "notes": ["same witness reads clearly as 31 in acts 4, 5, 8, 10 of this register year; scan-only consistency favors 31 but the ink here is ambiguous"]},
    "witness2.name": {"value": "[unclear: Mortka Fiszbin/Moszek Frydman]", "original_script": "[unclear: Мошка/Мортки] [unclear: Фишбина/Фридмана]", "confidence": "UNCLEAR", "observation_state": "PRESENT", "alternatives": [{"value": "Mortka Fiszbin", "original_script": "Мортки Фишбина"}, {"value": "Moszek Frydman", "original_script": "Мошка Фридмана"}], "source_span_ids": ["witness-lines", "signatures"], "notes": ["signature below act reads closer to Мордка Фришбинъ; same butcher witness appears clearly as Мортки Фишбина in acts 3, 4, 6, 8"]},
    "witness2.occupation": {"value": "butcher", "original_script": "мясника", "confidence": "PROBABLE", "observation_state": "PRESENT", "alternatives": [], "source_span_ids": ["witness-lines"], "notes": []},
    "witness2.age": {"value": 44, "original_script": "сорока четырехъ лѣтъ отъ роду", "confidence": "PROBABLE", "observation_state": "PRESENT", "alternatives": [], "source_span_ids": ["witness-lines"], "notes": []},
    "principal.sex": {"value": "male", "original_script": "младенца мужескаго пола", "confidence": "PROBABLE", "observation_state": "PRESENT", "alternatives": [], "source_span_ids": ["birth-lines"], "notes": []},
    "principal.birth_place": {"value": "village Popowo", "original_script": "родился въ деревнѣ Поповѣ", "confidence": "PROBABLE", "observation_state": "PRESENT", "alternatives": [], "source_span_ids": ["birth-lines"], "notes": []},